{
  "$schema": "squad-tactics.navigation/v1",
  "asset_id": "farmhouse_small_01",
  "owner": {
    "base_cell": [
      0,
      0
    ],
    "occupied_cells": [
      [
        0,
        0
      ],
      [
        1,
        0
      ]
    ]
  },
  "profiles": [
    "infantry",
    "vehicle"
  ],
  "source": {
    "blend": "farmhouse_small_01.blend",
    "generator": "kb3d_forge",
    "state": "d0"
  },
  "space": {
    "basis": "asset_local_xy",
    "hex_layout": "pointy_axial",
    "hex_radius_m": 9.0,
    "units": "meter"
  },
  "states": {
    "d0": {
      "barriers": [
        {
          "id": "yard_fence_east",
          "passable_gaps": [],
          "polyline": [
            [
              4.1,
              -3.0
            ],
            [
              4.1,
              3.1
            ]
          ],
          "profiles": [
            "infantry",
            "vehicle"
          ],
          "width_m": 0.12
        }
      ],
      "obstacles": [
        {
          "blocks_los": true,
          "blocks_projectile": true,
          "height_m": 3.2,
          "id": "building_shell",
          "polygon": [
            [
              -3.4,
              -2.5
            ],
            [
              3.4,
              -2.5
            ],
            [
              3.4,
              2.5
            ],
            [
              -3.4,
              2.5
            ]
          ],
          "profiles": [
            "infantry",
            "vehicle"
          ]
        }
      ],
      "portals": [
        {
          "connects": [
            "exterior",
            "room_main"
          ],
          "id": "front_door",
          "profiles": [
            "infantry"
          ],
          "segment": [
            [
              -0.55,
              -2.5
            ],
            [
              0.55,
              -2.5
            ]
          ],
          "width_m": 1.1
        }
      ],
      "regions": [
        {
          "allows": [
            "wait",
            "fire"
          ],
          "capacity": 4,
          "id": "room_main",
          "movement_cost_milli": 1000,
          "polygon": [
            [
              -3.0,
              -2.1
            ],
            [
              3.0,
              -2.1
            ],
            [
              3.0,
              2.1
            ],
            [
              -3.0,
              2.1
            ]
          ],
          "profiles": [
            "infantry"
          ]
        }
      ],
      "slots": [
        {
          "facing_deg": 90,
          "id": "window_north_fire_01",
          "kind": "fire",
          "point": [
            -1.6,
            1.8
          ],
          "profiles": [
            "infantry"
          ],
          "region": "room_main"
        }
      ],
      "surfaces": [
        {
          "id": "field_south",
          "kind": "field",
          "movement_cost_milli": 1350,
          "polygon": [
            [
              -8.0,
              -8.0
            ],
            [
              8.0,
              -8.0
            ],
            [
              8.0,
              -3.2
            ],
            [
              -8.0,
              -3.2
            ]
          ],
          "profiles": [
            "infantry",
            "vehicle"
          ]
        },
        {
          "id": "road_gate",
          "kind": "road",
          "movement_cost_milli": 800,
          "polygon": [
            [
              -1.8,
              -10.0
            ],
            [
              1.8,
              -10.0
            ],
            [
              1.8,
              -3.0
            ],
            [
              -1.8,
              -3.0
            ]
          ],
          "profiles": [
            "infantry",
            "vehicle"
          ]
        }
      ]
    }
  }
}
